{
  "surah": 1,
  "chapter_name_ar": "الفاتحة",
  "chapter_name_ja": "アル＝ファーティハ",
  "chapter_name_en": "Al-Fatihah",
  "traditional_order": 1,
  "approximate_theme": "神への賛美、慈悲への信頼、導きを願う祈り",
  "summary_ja": "第1章は、神への賛美と慈悲への信頼を表しつつ、正しい道への導きを願う短い祈りとして広く読まれる。章全体として、信仰姿勢の入口と祈願の骨格を簡潔に示す。",
  "ayahs": [
    {
      "ayah": 1,
      "arabic": "بِسْمِ اللَّهِ الرَّحْمَٰنِ الرَّحِيمِ",
      "romanized": "Bismi Allahi al-Rahmani al-Rahim",
      "literal_ja": "慈悲あまねく、慈愛深きアッラーの御名において。",
      "modern_ja": "慈しみ深く、憐れみに満ちた神の御名によって、これを始めます。",
      "summary_ja": "神の慈悲を覚えつつ、言葉と行為の始まりを神の御名に託す節として読まれる。",
      "themes": [
        "祈りの始まり",
        "神の慈悲",
        "唱念"
      ],
      "notes": [
        "冒頭の句は多くの場合バスマラと呼ばれ、慈悲を示す神名が前面に置かれる。",
        "逐語寄り表現では語順を保ちやすい一方、現代日本語では文脈に沿って補いが必要になる。"
      ],
      "caution": [
        "この句を各章の独立した節として数えるかどうかは、章や数え方の採用方針によって扱いが分かれる。"
      ]
    },
    {
      "ayah": 2,
      "arabic": "الْحَمْدُ لِلَّهِ رَبِّ الْعَالَمِينَ",
      "romanized": "Al-hamdu lillahi Rabbi al-'alamin",
      "literal_ja": "万有の主であるアッラーに、称賛あれ。",
      "modern_ja": "あらゆる世界を養い治める神に、賛美が帰されます。",
      "summary_ja": "賛美の帰属先が神であること、そして神が全世界の主であることを示す節である。",
      "themes": [
        "賛美",
        "神の主権",
        "世界"
      ],
      "notes": [
        "rabb は単なる所有者よりも、育み、保ち、導く主を含意する語として説明されることがある。",
        "al-'alamin は人間世界に限定せず、諸世界・被造物全体を含む広い表現として理解されることが多い。"
      ],
      "caution": [
        "日本語の『主』は封建的な主人像に狭めず、養育・統治・保護の広がりを注記で補うのが無難である。"
      ]
    },
    {
      "ayah": 3,
      "arabic": "الرَّحْمَٰنِ الرَّحِيمِ",
      "romanized": "Al-Rahmani al-Rahim",
      "literal_ja": "慈悲あまねく、慈愛深き御方。",
      "modern_ja": "その方は、広く慈しみ、深く憐れむ御方です。",
      "summary_ja": "神の性質としての慈悲と憐れみが、重ねて強調される節である。",
      "themes": [
        "神の慈悲",
        "神の属性",
        "反復"
      ],
      "notes": [
        "近い意味の二語が重ねられており、神の慈悲を強く印象づける構成になっている。",
        "日本語では両語を完全に訳し分けるのが難しいため、語感の差は注記で補うのが適している。"
      ],
      "caution": [
        "二つの神名の差異を一つの日本語語彙へ単純化すると、含意の違いが見えにくくなる。"
      ]
    },
    {
      "ayah": 4,
      "arabic": "مَالِكِ يَوْمِ الدِّينِ",
      "romanized": "Maliki yawmi al-din",
      "literal_ja": "報いの日の主宰者。",
      "modern_ja": "報いが明らかになるその日の支配者は、神です。",
      "summary_ja": "終末と報いの局面においても、最終的な権威が神に属することを示す節である。",
      "themes": [
        "終末",
        "報い",
        "神の権威"
      ],
      "notes": [
        "din はここでは宗教一般よりも、審判・報償・応報の文脈で説明されることが多い。",
        "この節は、現世だけでなく最終的な裁きの場面でも神の主権が及ぶことを印象づける。"
      ],
      "caution": [
        "読誦伝承では maliki と捉える形のほか、意味の近い別読が知られており、訳語固定には注意が必要である。"
      ]
    },
    {
      "ayah": 5,
      "arabic": "إِيَّاكَ نَعْبُدُ وَإِيَّاكَ نَسْتَعِينُ",
      "romanized": "Iyyaka na'budu wa iyyaka nasta'in",
      "literal_ja": "私たちは、あなたにのみ仕え、あなたにのみ助けを求める。",
      "modern_ja": "わたしたちはただあなたを礼拝し、ただあなたに助けを願います。",
      "summary_ja": "信仰の向き先を神のみに定め、礼拝と依頼の両方を神へ向ける宣言である。",
      "themes": [
        "礼拝",
        "帰依",
        "助けを願う"
      ],
      "notes": [
        "語順上、目的語が先に置かれており、『ただあなたに』という限定が強調される。",
        "複数形が用いられているため、個人の祈りでありつつ共同体的な響きも持つ。"
      ],
      "caution": [
        "na'budu を単に『奉仕する』とするか『礼拝する』とするかで、宗教実践の含意が変わりうる。"
      ]
    },
    {
      "ayah": 6,
      "arabic": "اهْدِنَا الصِّرَاطَ الْمُسْتَقِيمَ",
      "romanized": "Ihdina al-sirata al-mustaqim",
      "literal_ja": "私たちを、まっすぐな道へ導いてください。",
      "modern_ja": "どうか、わたしたちを正しくまっすぐな道へ導いてください。",
      "summary_ja": "信仰者が自力だけに頼らず、正しい道筋への導きを神に願う節である。",
      "themes": [
        "導き",
        "正しい道",
        "祈願"
      ],
      "notes": [
        "sirat al-mustaqim は倫理・信仰・生の歩みを含む広い比喩として理解されることが多い。",
        "現代日本語では『まっすぐ』を物理的意味に狭めないよう、『正しい』などの補いが使われやすい。"
      ],
      "caution": [
        "『正しい道』の具体的内容をどこまで教義的に確定するかは、注釈伝統によって温度差がある。"
      ]
    },
    {
      "ayah": 7,
      "arabic": "صِرَاطَ الَّذِينَ أَنْعَمْتَ عَلَيْهِمْ غَيْرِ الْمَغْضُوبِ عَلَيْهِمْ وَلَا الضَّالِّينَ",
      "romanized": "Sirata alladhina an'amta 'alayhim ghayri al-maghdubi 'alayhim wa la al-dallin",
      "literal_ja": "あなたが恩恵を授けた者たちの道。怒りを受けた者たちの道ではなく、また迷った者たちの道でもなく。",
      "modern_ja": "それは、あなたが恵みを与えた人々の道です。怒りを受けた者たちの道でも、迷いに陥った者たちの道でもありません。",
      "summary_ja": "求めるべき道を、神の恩恵を受けた人々の道として示しつつ、避けるべき道との対比で表現する節である。",
      "themes": [
        "導き",
        "恩恵",
        "対比",
        "迷いへの注意"
      ],
      "notes": [
        "前節の『まっすぐな道』を具体化し、望ましい歩みと避けるべき歩みを対比している。",
        "恩恵・怒り・迷いは、倫理的状態や霊的状態を含む重層的な表現として読まれることがある。"
      ],
      "caution": [
        "この節の対象を特定の集団へ即断的に当てはめる説明は、宗教間・歴史的文脈への配慮を欠きやすいため慎重であるべきである。",
        "注釈伝統には具体的な当てはめも存在するが、このデータでは理解支援の観点から一般化した記述にとどめている。"
      ]
    }
  ],
  "ayah_count_total": 7,
  "ayah_count_included": 7,
  "is_partial": false
}
